{
  "id": 1487,
  "topic": "kyc_verification",
  "subject": "9f2c4b1e-7a3d-4c8e-9b21-5f0e3a7d1c44",
  "occurred_at": "2026-09-04T09:14:22Z",
  "data": {
    "request_id": "9f2c4b1e-7a3d-4c8e-9b21-5f0e3a7d1c44",
    "status": "approved",
    "kyc_jws": "eyJhbGciOiJFZERTQSJ9.eyJzdWIiOiJhN2YzIiwibGV2ZWwiOiJ2ZXJpZmllZCJ9.SIG"
  }
}
